{
  "schema_version": 1,
  "asset": "run-scarf-02.png",
  "sha256": "c257e3910c138669851761807cf9a58119de17ca706b9b933a6fa85725fe81f7",
  "kind": "image",
  "origin": "generated",
  "created_at": "2026-09-29T01:54:17+00:00",
  "generator": {
    "tool": "gen",
    "tool_version": "0.1.0",
    "provider": "openai",
    "model": "gpt-image-2",
    "prompt": "Using the exact pose, camera angle, character scale and canvas framing of the first reference image (a running girl), paint ONLY a long, wide, flowing fabric scarf in a plain, flat, neutral medium-gray color, matching the gray of the second reference swatch image exactly (no other hue, no pattern, no shading gradient into a color, just neutral gray). The scarf drapes from around her neck/collar and streams and trails behind and above her from the wind of her running motion -- wide and voluminous, clearly broader than a thin ribbon, so it reads as a substantial scarf silhouette even at small size. Paint NOTHING else in the image: no character, no body, no face, no hands, no hood, no clothing, no background, no ground, no shadow, no text -- only the gray scarf shape, positioned and posed exactly where it would drape and trail relative to her neck and shoulders in the pose shown in the first reference image, on the same size canvas with the same framing, fully transparent everywhere else.",
    "params": {
      "size": "1024x1024",
      "quality": "high",
      "background": "transparent"
    },
    "inputs": [
      {
        "path": "assets/bakeoff/protagonist/glow-up/trial-b/frames/run-body-02.png",
        "sha256": "475bc75078a6b719528593dac82e125f4d5efa62e99a4504612c5422a3e38d65"
      },
      {
        "path": "assets/bakeoff/protagonist/parts/scarf1.png",
        "sha256": "e04f62829ca32800925de0329b4602f6d0778242fc9b6c57102c7e5527e7f09c"
      }
    ]
  },
  "human_edits": [],
  "license": "proprietary"
}
