{
  "schema_version": 1,
  "asset": "double_jump-scarf-00.round-04.png",
  "sha256": "82b07905705e2f7cedec70aa6a9d1f4886eae257a5cc28c9362bd20768a442ef",
  "kind": "image",
  "origin": "generated",
  "created_at": "2026-09-30T02:43:39+00:00",
  "generator": {
    "tool": "gen",
    "tool_version": "0.1.0",
    "provider": "openai",
    "model": "gpt-image-2",
    "prompt": "Using the exact pose, camera angle, character scale and canvas framing of the first reference image (an airborne girl), paint ONLY a long, wide, flowing fabric scarf in a plain, flat, neutral medium-gray color, matching the gray of the second reference swatch image exactly (no other hue, no pattern, no shading gradient into a color, just neutral gray). The scarf drapes from around her neck/collar and trails gently behind her from the ordinary rise of a jump -- wide and voluminous, clearly broader than a thin ribbon, so it reads as a substantial scarf silhouette even at small size. Paint exactly ONE continuous, solid, opaque scarf shape -- never multiple overlapping copies or echoes of the ribbon at different offsets, and never several semi-transparent stacked layers. Paint NOTHING else in the image: no character, no body, no face, no hands, no hood, no clothing, no background, no ground, no shadow, no text -- only the gray scarf shape, positioned and posed exactly where it would drape and trail relative to her neck and shoulders in the pose shown in the first reference image, on the same size canvas with the same framing, fully transparent everywhere else.",
    "params": {
      "size": "1024x1024",
      "quality": "high",
      "background": "transparent"
    },
    "inputs": [
      {
        "path": "assets/bakeoff/protagonist/glow-up/trial-b/frames/double_jump-body-00.round-04.png",
        "sha256": "610b343dc971969ab99455d3016a7699a30342e08b52c06550965fc43ceb7be9"
      },
      {
        "path": "assets/bakeoff/protagonist/parts/scarf1.png",
        "sha256": "e04f62829ca32800925de0329b4602f6d0778242fc9b6c57102c7e5527e7f09c"
      }
    ]
  },
  "human_edits": [
    {
      "by": "anthropic/claude-sonnet-5 (VioletRound5)",
      "description": "Frozen as double_jump-scarf-00.round-04.png for round 4's own shot provenance (identical bytes to the live double_jump-scarf-00.png through round 4, sha256 82b07905705e2f7cedec70aa6a9d1f4886eae257a5cc28c9362bd20768a442ef) before glow-up round 5's grade_b.py overwrote the live double_jump-scarf-00.png with a value/opacity grading pass; see assets/bakeoff/protagonist/glow-up/rounds.md.",
      "at": "2026-09-30T02:43:39+00:00"
    }
  ],
  "license": "proprietary"
}
