{
  "schema_version": 1,
  "asset": "dash-body-02.png",
  "sha256": "326b7914f86fd5ce137f08fcbfd7458fbdddeab8a5a2997883a977d26a1e2034",
  "kind": "image",
  "origin": "generated",
  "created_at": "2026-09-29T02:47:49+00:00",
  "generator": {
    "tool": "gen",
    "tool_version": "0.1.0",
    "provider": "openai",
    "model": "gpt-image-2",
    "prompt": "Frame-by-frame hand-painted 2D game sprite of Violet, a slender young girl adventurer, side-view profile facing right. She wears a hooded gray robe with a darker waist sash, an ankle-length robe skirt with a slightly darker hem, and goes barefoot with simple ankle wraps. Pale skin, dark hair just visible under the hood, a clearly readable young face in profile with a visible eye, brow, nose and mouth. Realistic child body proportions, about 5.5 head-heights tall, matching the reference turnaround exactly in design, coloring and proportions. Rendered as a single cohesive hand-painted illustration with soft painterly brushwork and visible brush texture, in a muted earthy palette (grays, browns, warm skin tones), NOT a flat vector cutout, in the painted-storybook register of games like Hollow Knight or GRIS. The same explosive horizontal dash burst pose as the peak of the sprint, held an instant later: torso still bent into the same steep, hard forward lean, head tucked low and forward, both arms swept sharply back and bent at the elbows, both legs bent and trailing behind her, body compact and streamlined -- but now caught with the sense that she has continued surging forward, weight still thrown hard into the direction of travel. This is NOT a jump, NOT a fall, and NOT a normal running stride -- read it as a fast horizontal dash sustained for a beat. Full body visible from the top of the hood to the soles of both bare feet, and both hands, entirely inside the canvas with generous empty margin on every side so nothing is cropped. She stands at a consistent scale and vertical position: the same distance from the top of her hood to the ground line as in the reference image(s). Transparent background, no ground plane, no cast shadow, no vignette, no border, no text, no watermark, no second copy of the character, no scarf or neck wrap of any kind -- bare gray robe collar at the neck; a separate layer will add the scarf later.",
    "params": {
      "size": "1024x1024",
      "quality": "high",
      "background": "transparent"
    },
    "inputs": [
      {
        "path": "assets/bakeoff/protagonist/concept/violet-turnaround.png",
        "sha256": "f2f023962adfdaf5707dabdf84846ff4ed803aa0e5a61e13972453ddf163c36a"
      },
      {
        "path": "assets/bakeoff/protagonist/glow-up/trial-b/frames/run-body-00.png",
        "sha256": "ce487d4ef731535263ed676870868c01d7707db67a0306b2b578c83f2cc90dfe"
      }
    ]
  },
  "human_edits": [
    {
      "by": "anthropic/claude-sonnet-5 (VioletBDashRunFix)",
      "description": "trimmed to the frame's shared body+scarf alpha>8 bounding-box union (95,80)-(992,911) of the raw 1024x1024 canvas -> 897x831, then rescaled by the trial's own factor 1.128227 (Lanczos, reused verbatim, not re-derived, so dash matches run's scale) -> 1012x938",
      "at": "2026-09-29T03:18:33+00:00"
    }
  ],
  "license": "proprietary"
}
