{
  "schema_version": 1,
  "asset": "dash-body-04.png",
  "sha256": "ef245a996c60b34de43a86def22ecfc8e5d11512699f8c9ae293899f1931ec6d",
  "kind": "image",
  "origin": "generated",
  "created_at": "2026-09-30T05:38:19+00:00",
  "generator": {
    "tool": "gen",
    "tool_version": "0.1.0",
    "provider": "openai",
    "model": "gpt-image-2",
    "prompt": "Frame-by-frame hand-painted 2D game sprite of Violet, a slender young girl adventurer, side-view profile facing right. She wears a hooded gray robe with a darker waist sash, an ankle-length robe skirt with a slightly darker hem, and goes barefoot with simple ankle wraps. Pale skin, dark hair just visible under the hood, a clearly readable young face in profile with a visible eye, brow, nose and mouth. Realistic child body proportions, about 5.5 head-heights tall, matching the reference turnaround exactly in design, coloring and proportions. Rendered as a single cohesive hand-painted illustration with soft painterly brushwork and visible brush texture, in a muted earthy palette (grays, browns, warm skin tones), NOT a flat vector cutout, in the painted-storybook register of games like Hollow Knight or GRIS. The dash burst beginning to settle from its longest stretch back toward the pose she'll hold: torso still bent into a steep forward lean, arms easing back in from their fullest reach toward her sides, legs drawing back in slightly from their most stretched extension, body still compact and streamlined but no longer at its most elongated. This is NOT a jump, NOT a fall, and NOT a normal running stride -- read it as a fast horizontal dash easing toward a sustained held pose. Full body visible from the top of the hood to the soles of both bare feet, and both hands, entirely inside the canvas with generous empty margin on every side so nothing is cropped. She stands at a consistent scale and vertical position: the same distance from the top of her hood to the ground line as in the reference image(s). Fully transparent background with ZERO pixels painted outside her own silhouette: no ground plane, no cast shadow, no vignette, no glow, no halo, no radial light, no gradient, no dark or light background tint of any kind, no border, no text, no watermark, no second copy of the character, no scarf or neck wrap of any kind -- bare gray robe collar at the neck; a separate layer will add the scarf later.",
    "params": {
      "size": "1024x1024",
      "quality": "high",
      "background": "transparent"
    },
    "inputs": [
      {
        "path": "assets/bakeoff/protagonist/concept/violet-turnaround.png",
        "sha256": "f2f023962adfdaf5707dabdf84846ff4ed803aa0e5a61e13972453ddf163c36a"
      },
      {
        "path": "assets/bakeoff/protagonist/glow-up/trial-b/frames/dash-body-03.png",
        "sha256": "a2f706838b808243725468bda206c99e5c10aa7884ce6525e34494339256359e"
      },
      {
        "path": "assets/bakeoff/protagonist/glow-up/trial-b/frames/dash-body-05.png",
        "sha256": "0fc46ce8baac21607714f340c5c96b4f86d43a7d4376ad12928cc43953e98b8f"
      }
    ]
  },
  "human_edits": [
    {
      "by": "VioletRound7 (Claude)",
      "description": "Round 7 (rounds.md, adding 3 in-between frames to dash per round 6's gap 3 'too few drawings... large pose jumps and no in-betweens'): cropped the raw body+scarf pair to their shared alpha>8 bbox union, rescaled both by the shared rig_per_raw factor (1.128227381210675, reused unchanged), and recorded head_x/head_y/target_head_x_fraction/target_head_y_fraction in dash-finalize-record.json (t = i * 0.2/6 on the new 6-frame even grid), matching dash's existing 'airborne, cell-fraction' anchor scheme. Then graded via trial-b/grade_b.py's grade_body/grade_scarf functions directly, matching every other technique-B frame's round-5 value pass.",
      "at": "2026-09-30T05:42:40+00:00"
    },
    {
      "by": "VioletRound7 (Claude)",
      "description": "Round 7: corrected the stale inputs[] hash for assets/bakeoff/protagonist/glow-up/trial-b/frames/dash-body-03.png -- it was recorded at generation time (before that frame's own body was cropped+rescaled to match its scarf's shared union bbox), so the hash on file went stale the moment the crop/rescale ran; updated to the current (post-crop) hash, matching the same correction round 4/6 made for fall/double_jump/idle's scarves.",
      "at": "2026-09-30T05:43:03.077936+00:00"
    }
  ],
  "license": "proprietary"
}
