{
  "schema_version": 1,
  "asset": "idle-scarf-03.round-04.png",
  "sha256": "f3294d87b1e0e3b62e5b8ff81349a0ddd2a25dc1f3900508bc02c96be2fdb548",
  "kind": "image",
  "origin": "generated",
  "created_at": "2026-09-30T02:43:31+00:00",
  "generator": {
    "tool": "gen",
    "tool_version": "0.1.0",
    "provider": "openai",
    "model": "gpt-image-2",
    "prompt": "Using the exact pose, camera angle, character scale and canvas framing of the first reference image (a standing girl), paint ONLY a long, wide, flowing fabric scarf in a plain, flat, neutral medium-gray color, matching the gray of the second reference swatch image exactly (no other hue, no pattern, no shading gradient into a color, just neutral gray). The scarf drapes from around her neck/collar and billows out further still, caught fully in the light unseen breeze, closer to the widest point of its gentle sway, wide and voluminous, clearly broader than a thin ribbon, so it reads as a substantial scarf silhouette even at small size. Paint NOTHING else in the image: no character, no body, no face, no hands, no hood, no clothing, no background, no ground, no shadow, no text -- only the gray scarf shape, positioned and posed exactly where it would drape and trail relative to her neck and shoulders in the pose shown in the first reference image, on the same size canvas with the same framing, fully transparent everywhere else. IMPORTANT: paint exactly ONE single opaque, solid gray scarf shape -- do not paint multiple overlapping, ghosted or semi-transparent copies of the scarf at different offsets; the scarf must be one continuous, fully opaque cloth shape, not several stacked layers.",
    "params": {
      "size": "1024x1024",
      "quality": "high",
      "background": "transparent"
    },
    "inputs": [
      {
        "path": "assets/bakeoff/protagonist/glow-up/trial-b/frames/idle-body-03.round-04.png",
        "sha256": "2de225822b9c763d20b02314fa9f7a868696ae89ebc83c11c8de1133d6969951"
      },
      {
        "path": "assets/bakeoff/protagonist/parts/scarf1.png",
        "sha256": "e04f62829ca32800925de0329b4602f6d0778242fc9b6c57102c7e5527e7f09c"
      }
    ]
  },
  "human_edits": [
    {
      "by": "anthropic/claude-sonnet-5 (VioletRound5)",
      "description": "Frozen as idle-scarf-03.round-04.png for round 4's own shot provenance (identical bytes to the live idle-scarf-03.png through round 4, sha256 f3294d87b1e0e3b62e5b8ff81349a0ddd2a25dc1f3900508bc02c96be2fdb548) before glow-up round 5's grade_b.py overwrote the live idle-scarf-03.png with a value/opacity grading pass; see assets/bakeoff/protagonist/glow-up/rounds.md.",
      "at": "2026-09-30T02:43:31+00:00"
    }
  ],
  "license": "proprietary"
}
