{
  "schema_version": 1,
  "asset": "leg_back_upper.png",
  "sha256": "39c08656603b437279a634f49995e46efd3f1b9b520e8bce4d3392e8389257e1",
  "kind": "image",
  "origin": "generated",
  "created_at": "2026-09-27T18:22:53+00:00",
  "generator": {
    "tool": "gen",
    "tool_version": "0.1.0",
    "provider": "openai",
    "model": "gpt-image-2",
    "prompt": "Only the thigh under the robe hem, from hip to knee, wrapped in the same muted fabric as the robe, no torso, no shin, extending slightly past the knee for overlap of the character in the reference, side view facing right, same painted soft-edged style and palette as the reference, centred on the canvas, nothing else in frame, no ground, no shadow, no text, transparent background",
    "params": {
      "size": "1024x1024",
      "quality": "high",
      "background": "transparent"
    },
    "inputs": [
      {
        "path": "assets/bakeoff/protagonist/concept/violet-turnaround.png",
        "sha256": "f2f023962adfdaf5707dabdf84846ff4ed803aa0e5a61e13972453ddf163c36a"
      }
    ]
  },
  "human_edits": [
    {
      "by": "anthropic/claude-opus-5-5 (omp)",
      "description": "trimmed transparent margin to the alpha > 8 bounding box: 1024x1024 -> 310x887",
      "at": "2026-09-27T18:42:21+00:00"
    },
    {
      "by": "anthropic/claude-opus-5-5 (omp)",
      "description": "rescaled by factor 0.352 (Lanczos), 310x887 -> 109x312, to the shared rig scale: 1000 px crown to sole, from the turnaround's side view (crown y=80, sole y=960, so 1.136 rig px per turnaround px); see assets/bakeoff/protagonist/README.md. Hip to knee plus overlap (887 painted px) set to 312 px: thigh 292 = 54% of the 540 px hip-to-floor (hip joint inferred under the robe) plus 20 px overlap.",
      "at": "2026-09-27T18:42:21+00:00"
    },
    {
      "by": "anthropic/claude-sonnet-5 (omp)",
      "description": "Glow-up round 3 (color_readability/visual_quality gap: round 2's own critique measured the robe body at luminance ~124 against this sheet's own neutral-gray backdrop at ~127, a ~1% difference, so on anything but a pure neutral floor most of the body reads as one dark blob; the critique also flagged a lighter tan patch on the mid-right skirt that cuts across the fabric folds at a hard, straight edge, reading as a leftover texture seam rather than a fold). Round 2's own critique also named the hard-edged seam this fixes: this thigh-wrap fabric is the same robe cloth as the skirt/torso (README: 'thigh wrapped in robe fabric'), and it shows through the skirt's front slit in raised-leg poses (jump/double_jump/dash) at a noticeably lighter, flatter tone than the surrounding skirt, reading as a foreign patch with a hard straight edge rather than a fold. Not a new gen call: a per-channel levels match (mean and std-dev of R/G/B over alpha>8 pixels) brought this asset from mean RGB [118.1, 105.2, 95.6] (std [17.1, 15.3, 14.0]) to mean RGB [106.3, 93.3, 83.9] (std matched to the newly repainted hips/torso's own [26.3, 22.8, 20.5]), so the same fabric now reads as the same fabric wherever the rig reveals it.",
      "at": "2026-09-29T02:40:46+00:00"
    }
  ],
  "license": "proprietary"
}
