{
  "schema_version": 1,
  "asset": "boulder-b.glb",
  "sha256": "422bf5d2f5e7916357ba4373aa0dfd04b287fe433ba7ba337ff317640465953f",
  "kind": "model3d",
  "origin": "generated",
  "created_at": "2026-09-27T17:59:31+00:00",
  "generator": {
    "tool": "blender",
    "tool_version": "5.2.2",
    "provider": "anthropic",
    "model": "claude-opus-5-5",
    "prompt": "boulder-b: chipped tabular sandstone slab tipped up on a smaller rock; low-poly Blender Python piece of the Phase 1 bake-off desert kit following docs/bakeoff/desert-biome-brief.md",
    "params": {
      "seed": "20260927"
    },
    "inputs": [
      {
        "path": "assets/bakeoff/desert-kit-3d/build_kit.py",
        "sha256": "1a80d7495317cb59025cddbc83fa64f099b5a392024d363611c3348f36444c36"
      }
    ]
  },
  "human_edits": [],
  "license": "proprietary"
}
