{
  "schema_version": 1,
  "asset": "head.round-00.png",
  "sha256": "81960bde8738760d562474083f5398ba8c186b48d35cd6654660a748cb0318fd",
  "kind": "image",
  "origin": "generated",
  "created_at": "2026-09-29T01:00:58+00:00",
  "generator": {
    "tool": "gen",
    "tool_version": "0.1.0",
    "provider": "openai",
    "model": "gpt-image-2",
    "prompt": "Only the hooded head and neck of the character in the reference, matching the front-facing view's hood and face exactly, but turned to the side view facing right (use the reference's right-side view for the head angle), same painted soft-edged style and palette (muted warm gray hood #8a8078, a hint of the red scarf collar at the neck only if it appears at the neck in the reference), centred on the canvas, nothing else in frame, no body, no ground, no shadow, no text, transparent background",
    "params": {
      "size": "1024x1024",
      "quality": "high",
      "background": "transparent"
    },
    "inputs": [
      {
        "path": "assets/bakeoff/protagonist/concept/violet-turnaround.png",
        "sha256": "f2f023962adfdaf5707dabdf84846ff4ed803aa0e5a61e13972453ddf163c36a"
      }
    ]
  },
  "human_edits": [
    {
      "by": "anthropic/claude-opus-5-5 (omp)",
      "description": "trimmed transparent margin to the alpha > 8 bounding box: 903x947 -> 598x644",
      "at": "2026-09-29T01:01:08+00:00"
    },
    {
      "by": "anthropic/claude-opus-5-5 (omp)",
      "description": "recolored the saturated red scarf collar (rows 440+) to neutral gray matching scarf1-3, which lanes tint; skin, hair and hood untouched",
      "at": "2026-09-29T01:01:08+00:00"
    },
    {
      "by": "anthropic/claude-opus-5-5 (omp)",
      "description": "rescaled by factor 0.335 (Lanczos), 598x644 -> 200x216, to the shared rig scale: 1000 px crown to sole, from the turnaround's side view (crown y=80, sole y=960, so 1.136 rig px per turnaround px); see assets/bakeoff/protagonist/README.md. Fitted so the hood crown and the chin land on the turnaround's (crown 0, chin ~177 px below it at rig scale); 216 px tall, about 4.6 heads to the figure.",
      "at": "2026-09-29T01:01:08+00:00"
    },
    {
      "by": "anthropic/claude-opus-5-5 (omp)",
      "description": "frozen as head.round-00.png for glow-up round 0's historical shot provenance (identical bytes to the pre-round-1 assets/bakeoff/protagonist/parts/head.png, sha256 81960bde8738760d562474083f5398ba8c186b48d35cd6654660a748cb0318fd) before round 1 replaced the live head.png with a new painting; see docs/bakeoff/protagonist/glow-up/rounds.md.",
      "at": "2026-09-29T01:01:08+00:00"
    }
  ],
  "license": "proprietary"
}
