{
  "schema_version": 1,
  "asset": "crystal-wall.png",
  "sha256": "24482aedce1320f186a4d9424825b5831fc76924e49e0f052735d405dab02d26",
  "kind": "image",
  "origin": "generated",
  "created_at": "2026-09-27T09:28:45+00:00",
  "generator": {
    "tool": "gen",
    "tool_version": "0.1.0",
    "provider": "openai",
    "model": "gpt-image-2",
    "prompt": "A square texture tile of a solid wall of pale, untinted, near-white and light gray translucent crystal (no hue at all, only grays), made of tall faceted crystal columns running top to bottom with soft inner light and gentle painterly highlights, filling the whole square edge to edge. This is a seamless repeating texture: it wraps around vertically, so the top edge continues exactly into the bottom edge and the crystal columns run on through both edges without ending, with even lighting. Flat side view, no background visible. Fine-art hand-painted 2D game art in soft gouache and watercolor washes: large simple shapes, low detail, muted atmospheric golden-hour color, gentle gradients, soft edges, visible brush texture; a serene illustrated indie-game look, not cartoon and not mobile-game style. Brief palette: sand #d9b27c, rock #a86f46, shadow violet #5a4a7a, sky peach #f2c49b and teal #3f7f8c; crystal colors ember red #e04a3a, verdant green #3fbf6a, gray #8c8c8c (crystal colors appear only on crystal pieces).",
    "negative_prompt": "text, letters, numbers, watermark, signature, black outlines, ink line art, cel shading, cartoon, mobile-game style, bricks, anime, pixel art, photorealism, 3D render, frame, border, vignette, drop shadow",
    "params": {
      "size": "1024x1024",
      "quality": "high",
      "background": "opaque"
    },
    "inputs": []
  },
  "human_edits": [],
  "license": "proprietary"
}
