{
  "schema_version": 1,
  "asset": "apply_scarf_attachments.py",
  "sha256": "b465a5aec57d4adfcfb949b15a0fb72dd35eb8e22763edd487af69e621fed456",
  "kind": "animation",
  "origin": "generated",
  "created_at": "2026-09-30T17:38:48+00:00",
  "generator": {
    "tool": "agent-authored Python",
    "tool_version": "scarf-attachment-correction",
    "provider": "openai-codex",
    "model": "gpt-6-astra",
    "prompt": "Bind verified source-image scarf knots to anatomical neck landmarks; refuse changed pixels or incomplete coverage; provide apply and check modes.",
    "params": {},
    "inputs": []
  },
  "human_edits": [],
  "license": "proprietary"
}
