{
  "schema_version": 1,
  "asset": "arm_front_lower.round-02.png",
  "sha256": "8f1df9ed8700868b3d71da7d036f36e2ee1af19f14779f11f9a736fa7b0c3c13",
  "kind": "image",
  "origin": "generated",
  "created_at": "2026-09-28T17:07:29+00:00",
  "generator": {
    "tool": "gen",
    "tool_version": "0.1.0",
    "provider": "openai",
    "model": "gpt-image-2",
    "prompt": "Only the forearm and relaxed hand, hanging straight down vertically from the elbow at the top, the forearm covered by the lower part of the robe's wide bell sleeve from the elbow to its wide open cuff, the relaxed hand and wrist emerging below the cuff with fingers gently curled, forearm and hand in one straight line, no upper arm, no shoulder, no torso of the character in the reference, side view facing right, same painted soft-edged style and palette as the reference, centred on the canvas, nothing else in frame, no ground, no shadow, no text, transparent background",
    "params": {
      "size": "1024x1024",
      "quality": "high",
      "background": "transparent"
    },
    "inputs": [
      {
        "path": "assets/bakeoff/protagonist/concept/violet-turnaround.png",
        "sha256": "f2f023962adfdaf5707dabdf84846ff4ed803aa0e5a61e13972453ddf163c36a"
      }
    ]
  },
  "human_edits": [
    {
      "by": "anthropic/claude-opus-5-5 (omp)",
      "description": "trimmed transparent margin to the alpha > 8 bounding box: 1024x1024 -> 275x928",
      "at": "2026-09-28T17:12:18+00:00"
    },
    {
      "by": "anthropic/claude-opus-5-5 (omp)",
      "description": "rescaled by factor 0.25 (Lanczos), 275x928 -> 69x232, to the shared rig scale: 1000 px crown to sole, from the turnaround's side view (crown y=80, sole y=960); see assets/bakeoff/protagonist/README.md. Elbow to fingertips (853 painted px) set to ~213 px: the sleeve cuff lands ~150 px below the elbow, at the turnaround's cuff (y=520-585), and the hand is ~65 px (turnaround 62-71).",
      "at": "2026-09-28T17:12:18+00:00"
    },
    {
      "by": "anthropic/claude-sonnet-5 (omp)",
      "description": "Frozen as arm_front_lower.round-02.png for rounds 0-2's historical shot provenance (identical bytes to the live arm_front_lower.png through round 2, sha256 8f1df9ed8700868b3d71da7d036f36e2ee1af19f14779f11f9a736fa7b0c3c13) before glow-up round 3 overwrote the live arm_front_lower.png with a repaint; see docs/bakeoff/protagonist/glow-up/rounds.md.",
      "at": "2026-09-29T02:38:55+00:00"
    }
  ],
  "license": "proprietary"
}
