{
  "schema_version": 1,
  "asset": "idle-scarf-04.round-07.png",
  "sha256": "adc73c2adbd60036e23dde2bc1014141a0265b562a81e60d2f02d6ba78e42462",
  "kind": "image",
  "origin": "generated",
  "created_at": "2026-09-30T04:33:26+00:00",
  "generator": {
    "tool": "gen",
    "tool_version": "0.1.0",
    "provider": "openai",
    "model": "gpt-image-2",
    "prompt": "The first reference image is a TIGHTLY cropped character with almost no empty margin around her (a post-processed crop, not the original generation framing). Mentally place that same reference image inside a much larger, mostly empty 1024x1024 transparent canvas: she would occupy only the region from about x=230,y=344 to about x=589,y=904 (about 560 px tall, left-of-center, with generous empty margin above, below, to the left and especially to the right of her). Her neck/collar, where the hood meets her shoulders, sits at approximately x=356-535, y=434-467 in that same 1024x1024 canvas. The second reference image shows the scarf from the previous frame of this same breathing-idle loop, already correctly scaled and positioned in its own 1024x1024 canvas at this same character scale and neck location. Using that exact character scale and canvas framing, paint ONLY a long, wide, flowing fabric scarf in the same plain, flat, neutral medium-gray color as the second reference image (no other hue, no pattern, no shading gradient into a color, just neutral gray), tied around her neck at that same x/y location. Match the second reference image's scarf shape, drape and position almost exactly -- change it only by an almost imperceptible micro-sway of at most a few pixels at the very tip of the hem, nowhere near a breeze, gust, or dramatic drift; the overall silhouette must look essentially the same as the second reference image's scarf shape. Most of its length falls in the region below and slightly right of the neck point, mostly overlapping where her robe and torso would be (that overlap is correct and expected, since her body will be drawn on top of it afterward) -- do not draw the scarf away from that neck point out in the empty right two-thirds of the canvas. Wide and voluminous, clearly broader than a thin ribbon. Paint NOTHING else in the image: no character, no body, no face, no hands, no hood, no clothing, no background, no ground, no shadow, no text -- only the gray scarf shape, on the same size canvas with the same framing, fully transparent everywhere else, with no vignette or darkened backdrop of any kind. IMPORTANT: paint exactly ONE single opaque, solid gray scarf shape -- do not paint multiple overlapping, ghosted or semi-transparent copies of the scarf at different offsets; the scarf must be one continuous, fully opaque cloth shape, not several stacked layers.",
    "params": {},
    "inputs": [
      {
        "path": "assets/bakeoff/protagonist/glow-up/trial-b/frames/idle-body-04.round-07.png",
        "sha256": "dc50db1525d1197ec7b281a183c56f275cb6a8b45a44039e8b0a840514151d6b"
      },
      {
        "path": "assets/bakeoff/protagonist/glow-up/trial-b/frames/idle-scarf-03.round-07.png",
        "sha256": "02ede3519cb7353fb3d9094ba05dae925d94246f3510f524ae3de720c3e4e3a2"
      }
    ]
  },
  "human_edits": [
    {
      "by": "VioletRound6 (Claude)",
      "description": "Round 6 (rounds.md, fixing round 5's gap 1, idle's ~60px scarf billow): cropped the raw generation to the scarf's own alpha>8 bbox, rescaled by the shared RIG_PER_RAW factor (1.128227381210675, reused unchanged), and recorded scarf_offset_final (rig units, from the body's existing crop origin) so shoot_b.py's render_cell_b can register it without moving or re-cropping the body -- same recipe as finalize_run_scarf_fix.py. Then graded via trial-b/grade_b.py's grade_scarf function (morphological alpha close + narrow edge blur), applied directly rather than through grade_b.py's own round-5 batch pipeline, since that pipeline reads a now-stale round-04 frozen copy that predates this repaint.",
      "at": "2026-09-30T04:33:36+00:00"
    },
    {
      "by": "VioletRound8 (Claude)",
      "description": "Frozen as idle-scarf-04.round-07.png for round 7's own shot provenance (identical bytes to the live idle-scarf-04.png through round 7, same generator metadata as the live file's own round-7 record since it's the same pixels/bytes, just parked at a path nothing will touch again) before glow-up round 8 overwrote the live idle-scarf-04.png with a procedural idle hybrid (idle_hybrid.py: one held body painting (idle-body-00) and one held scarf painting (idle-scarf-00), each animated by a deterministic warp -- a piecewise vertical breathing stretch above a fixed waist line for the body, a piecewise horizontal sway shear below a fixed neck pivot for the scarf -- instead of 8 separate from-scratch paintings, fixing round 7's kept gap 1, 'boiling'); see assets/bakeoff/protagonist/glow-up/rounds.md's 'Frozen inputs' convention.",
      "at": "2026-09-30T06:36:48+00:00"
    },
    {
      "by": "VioletRound8 (Claude)",
      "description": "Re-pointed this frozen frame's own generator.inputs paths from the live idle-body/-scarf paths (now stale: round 8's idle_hybrid.py overwrote them) to their matching round-07 frozen copies, which carry the exact bytes this record originally cited by hash; no bytes of this asset itself changed. rounds.md's 'Frozen inputs' convention (re-pointing a superseded round's own shot record at the frozen copy).",
      "at": "2026-09-30T06:38:39+00:00"
    }
  ],
  "license": "proprietary"
}
