{
  "schema_version": 1,
  "asset": "torso.png",
  "sha256": "e07d9c471212677d64efb6bfd06d56989841263bcf96856b1e0f7a7b3c46876a",
  "kind": "image",
  "origin": "generated",
  "created_at": "2026-09-27T17:13:46+00:00",
  "generator": {
    "tool": "gen",
    "tool_version": "0.1.0",
    "provider": "openai",
    "model": "gpt-image-2",
    "prompt": "Only the the robe torso from the shoulders down to the waist only, no arms, no legs, no head, no scarf drape, just the gray robe fabric with the dark waist sash of the character in the reference, side view facing right, same painted soft-edged style and palette as the reference, centred on the canvas, nothing else in frame, no ground, no shadow, no text, transparent background",
    "params": {
      "size": "1024x1024",
      "quality": "high",
      "background": "transparent"
    },
    "inputs": [
      {
        "path": "assets/bakeoff/protagonist/concept/violet-turnaround.png",
        "sha256": "f2f023962adfdaf5707dabdf84846ff4ed803aa0e5a61e13972453ddf163c36a"
      }
    ]
  },
  "human_edits": [
    {
      "by": "lead-agent",
      "description": "trimmed transparent margin",
      "at": "2026-09-27T17:53:53+00:00"
    }
  ],
  "license": "proprietary"
}
