{
  "schema_version": 1,
  "asset": "scarf1.png",
  "sha256": "217e0deb93ba3a328b1220ee5eefebc8b83dc25b37695865ea67e7cccbd1842d",
  "kind": "image",
  "origin": "generated",
  "created_at": "2026-09-27T17:46:58+00:00",
  "generator": {
    "tool": "gen",
    "tool_version": "0.1.0",
    "provider": "openai",
    "model": "gpt-image-2",
    "prompt": "Only one single straight flat ribbon-shaped segment of the character's long trailing scarf, the saturated scarf red seen in the reference, soft frayed edges, no body, no head, no other object of the character in the reference, side view facing right, same painted soft-edged style and palette as the reference, centred on the canvas, nothing else in frame, no ground, no shadow, no text, transparent background",
    "params": {
      "size": "1024x1024",
      "quality": "high",
      "background": "transparent"
    },
    "inputs": [
      {
        "path": "assets/bakeoff/protagonist/concept/violet-turnaround.png",
        "sha256": "f2f023962adfdaf5707dabdf84846ff4ed803aa0e5a61e13972453ddf163c36a"
      }
    ]
  },
  "human_edits": [
    {
      "by": "lead-agent",
      "description": "trimmed transparent margin",
      "at": "2026-09-27T17:53:54+00:00"
    }
  ],
  "license": "proprietary"
}
